{"schema":"romeo/result-envelope@0.1.0","unit_id":"feat-20260904-gate-fixture-coverage-q3wy","role":"reviewer","task_envelope_ref":{"path":"docs/work/feat-20260904-gate-fixture-coverage-q3wy/task/run_60db3d61480b-reviewer.json","sha256":"6c1063a0e224ee4378dbf88b9223d31fd1794fac7a9b382f5cea6dbfef3b43a2"},"checks":[],"gate_verdict":"PASS","blocked_reason":null,"findings":[],"evidence_ref":"docs/work/feat-20260904-gate-fixture-coverage-q3wy/evidence/run_60db3d61480b.yaml","notes":"두 작업 계약의 base_sha와 required_checks가 일치한다. 기록된 check-1·check-2와 원시 로그, 현재 fixture·검사 코드, 항목별 근거 및 human_correction 기록으로 AC-1~AC-6을 확인했다. 변경 파일은 구현자 allowed_paths 안이며 가드 대상 행동은 없다."}