{"schema": "romeo/result-envelope@0.1.0", "unit_id": "feat-20260829-license-field-46an", "role": "reviewer", "task_envelope_ref": {"path": "docs/work/feat-20260829-license-field-46an/task/run_222f508b5541-reviewer.json", "sha256": "f79f4bc1283a7e027b8ff088fdcd86c08416f57c6dea9d382c59180ec1bdfefd"}, "checks": [], "gate_verdict": "PASS", "blocked_reason": null, "findings": [{"summary": "AC-1 의 뒷부분('값이 계획 §1.3 표와 일치한다')을 검사하는 required_check 가 없다. check-2 는 `- License:` 줄이 있는 파일 수와 archive 디렉터리 수만 비교하므로 값이 틀려도 통과한다. 값의 정합은 이 검토의 읽기(archive/*/_source.md 18개 vs docs/planning/implementation-plan.md:72-89)로만 확인했고, 종료 검사의 재실행으로는 확인되지 않는 미검증 잔여다.", "file": "docs/work/feat-20260829-license-field-46an/spec.md", "line": 75}, {"summary": "nextlevelbuilder-ui-ux-pro-max-skill 의 값이 'MIT' 로만 적혀, 계획 §1.3 의 단서(루트 MIT, 단 cli/README.md 는 CC-BY-NC-4.0 표기 → 코드 포함 보류 K-42, implementation-plan.md:86)가 헤더와 archive/README.md:27 에서 사라졌다. 구현 단위 1의 '실물 값' 규칙 아래에서는 허용되는 선택이지만, '아카이브만 보고 재사용 가능 여부를 안다'는 목적(spec.md:39)에 비해 더 허용적으로 읽힌다. 권고: 'MIT (cli/README.md 는 CC-BY-NC-4.0 표기)'.", "file": "archive/nextlevelbuilder-ui-ux-pro-max-skill/_source.md", "line": 6}, {"summary": "anthropics-skills 의 값 'Varies by skill' 은 계획 §1.3 표 문자열('API NONE / 루트 LICENSE 없음, 스킬별 LICENSE.txt → 스킬 단위로 확인 필요', implementation-plan.md:78)의 요약이지 '표 그대로'는 아니다. 단일 실물 값이 없는 행이라 의미는 보존되어 있어 AC-1 위반으로 보지 않으나, 값 규칙의 예외로 기록해 둔다.", "file": "archive/anthropics-skills/_source.md", "line": 6}, {"summary": "증거에 같은 id 로 폐기된 초기 기록이 남아 있다. check-2 가 `test 18 = 18` 로(evidence:31), check-3 이 `/tmp/check3.sh` 로(evidence:51) 기록됐다 — 앞의 것은 아카이브 상태와 무관하게 항상 통과하는 항등식이고, 뒤의 것은 저장소 밖 스크립트라 종료 검사가 열어보거나 재실행할 수 없다. 최종 기록(evidence:95-115)이 계획의 명령 문자열과 일치하므로 주장 자체는 앵커되어 있으나, 종료 검사가 id·종료 코드만 대조하고 명령 문자열을 대조하지 않으면 이 폐기 기록이 통과 근거로 잡힐 수 있다.", "file": "docs/work/feat-20260829-license-field-46an/evidence/run_31e175742892.yaml", "line": 31}, {"summary": "changed_files 에 이 작업과 무관한 저장소 루트의 미추적 파일 12개(_source.md, 00-exploration.md, 01-docs/, 03-components/ 등)가 들어 있다. 루트 _source.md 는 obra/superpowers 아카이브(Analysis timestamp 2026-08-24)이고, spec.md:53 은 '아카이브 본문(00~06, 01-docs/, 03-components/)'을 비범위로 명시한다. 읽기만으로는 이 실행이 만든 것인지 이전 세션의 잔여물인지 판별할 수 없다 — 어느 쪽이든 changed_files 가 이 실행의 변경분을 변별하지 못한다.", "file": "docs/work/feat-20260829-license-field-46an/evidence/run_31e175742892.yaml", "line": 183}, {"summary": "구현자 작업 계약의 allowed_paths 에 '.' 이 들어 있어 워크트리 전체가 허용 범위가 된다. 그 결과 '변경이 allowed_paths 안인가' 판정이 이 단위에서는 아무것도 걸러내지 못하고, 위 루트 파일 12개도 자동으로 범위 안이 된다. 경로 상한을 spec.md:51 의 변경 범위(archive/, scripts/, docs/work/<id>/)로 좁힐 것을 권고한다.", "file": "docs/work/feat-20260829-license-field-46an/task/run_31e175742892-implementer.json", "line": 12}, {"summary": "check-3 은 검증기의 종료 코드가 0이 아니라는 것만 확인하고 실패 사유를 확인하지 않는다 — License 검사가 아닌 다른 이유로 실패해도 통과한다. 이번 실행 로그(.harness/runs/feat-20260829-license-field-46an/run_31e175742892/10-check-3.log:5)에는 'FAIL: _source.md does not contain a License field' 가 찍혀 있어 AC-2 의 귀속은 확인됐으나, 재실행 대조는 종료 코드만 보므로 그 귀속은 다음 실행에서 보장되지 않는다. 권고: 실패 메시지 문자열까지 대조.", "file": "docs/work/feat-20260829-license-field-46an/spec.md", "line": 78}, {"summary": "검증 계획 도입 문장이 '아래 넷은 모두 재실행해도 결론이 같고 작업 트리를 바꾸지 않는다'라고 적혀 있으나 아래 목록은 다섯이다(spec.md:70-86). 승인 시점의 spec sha256 과 두 작업 계약의 required_checks 가 5개로 동일하므로 실행 중 계획이 축소·교체된 흔적은 없고 문구만 낡았다. 다만 재실행 안전성 선언이 다섯 번째 검사를 문면상 덮지 않는다.", "file": "docs/work/feat-20260829-license-field-46an/spec.md", "line": 67}], "evidence_ref": "docs/work/feat-20260829-license-field-46an/evidence/run_31e175742892.yaml"}