{
  "schema": "romeo/result-envelope@0.1.0",
  "unit_id": "feat-20260907-close-review-reapproval-reach-bjec",
  "role": "implementer",
  "task_envelope_ref": {
    "path": "docs/work/feat-20260907-close-review-reapproval-reach-bjec/task/run_f05203fad6a8-implementer.json",
    "sha256": "8e697ab014ffe5af3c675277559a9976b76c2390091e719c62210ad6aa5fd3ef"
  },
  "checks": [
    {
      "id": "check-1",
      "command": "python3 -m unittest tests.test_docs_evidence_close.TestCloseReviewVerdict.test_a_recorded_verdict_under_a_superseded_approval_is_superseded_even_when_its_product_is_unreadable",
      "exit_code": 0
    },
    {
      "id": "check-2",
      "command": "python3 -m unittest tests.test_docs_evidence_close.TestCloseReviewVerdict.test_a_reapproval_alone_does_not_close_a_unit_whose_only_verdict_is_unidentifiable",
      "exit_code": 0
    },
    {
      "id": "check-3",
      "command": "python3 -m unittest tests.test_docs_evidence_close.TestCloseReviewVerdict.test_an_unidentifiable_verdict_of_the_current_approval_still_blocks",
      "exit_code": 0
    },
    {
      "id": "check-4",
      "command": "python3 -m unittest tests.test_docs_evidence_close.TestCloseReviewVerdict.test_retargeting_the_task_ref_cannot_make_a_current_fail_look_superseded",
      "exit_code": 0
    },
    {
      "id": "check-5",
      "command": "python3 -m unittest tests.test_docs_evidence_close.TestCloseReviewVerdict.test_an_unrecorded_verdict_under_a_superseded_approval_stays_unverified",
      "exit_code": 0
    },
    {
      "id": "check-6",
      "command": "grep -q 'REVIEW_SUPERSEDED' core/workflows/plan-close/SKILL.md",
      "exit_code": 0
    },
    {
      "id": "check-7",
      "command": "bin/romeo compile --check",
      "exit_code": 0
    },
    {
      "id": "check-8",
      "command": "python3 -m unittest discover -s tests -q",
      "exit_code": 0
    },
    {
      "id": "check-9",
      "command": "python3 -m unittest tests.test_attach_requirements tests.test_enforce_points",
      "exit_code": 0
    },
    {
      "id": "check-10",
      "command": "python3 -m unittest tests.test_docs_evidence_close.TestCloseReviewVerdict.test_the_real_2026_09_06_envelope_is_superseded_after_a_reapproval",
      "exit_code": 0
    }
  ],
  "gate_verdict": "PASS",
  "blocked_reason": null,
  "findings": [],
  "evidence_ref": "docs/work/feat-20260907-close-review-reapproval-reach-bjec/evidence/run_f05203fad6a8.yaml",
  "notes": "2회차다. 1회차 검토자 FAIL findings 2건은 전부 AC 문장의 결함을 지목했고, 사람이 그 셋(AC-1·AC-2·AC-7)을 고쳐 재승인했다(95b34eb · approval_history 3번째). 그래서 이 회차가 산출물에 더한 변경은 한 가지다 — 재승인된 AC-1 의 새 요구(「그 치환은 검사 안에서 명시적으로 하고 무엇을 바꿨는지 적는다」)를 check-10 이 충족하게 한 것. 치환 목록을 `SUBSTITUTED = (\"unit_id\", \"task_envelope_ref\", \"evidence_ref\")` 로 이름 지어 적고, 이월을 화이트리스트가 아니라 여집합으로 바꿔 실물의 모든 키가 치환·이월 중 하나로 처리됨을 단언하며(assertEqual set(SUBSTITUTED)|set(carried) == set(real)), 기록된 봉투에서 그 세 값이 실물과 다르고 픽스처 환경의 값임을 단언한다. AC-1 이 지목한 판정 본문 다섯 값이 전부 carried 에 있음도 단언한다. 근거: 이 run 의 check-10 exit 0. 이 변경 전 상태에서도 check-10 은 통과했으므로 이것은 판별력을 더한 것이 아니라 AC 가 요구한 명시성을 채운 것이다. AC-7 의 실측: 이 run 의 check-8 로그(.harness/runs/feat-20260907-close-review-reapproval-reach-bjec/run_f05203fad6a8/08-check-8.log 6행) 가 「Ran 910 tests」 이고 OK 다 — 재승인된 확인란의 910 과 일치한다. tests/test_docs_evidence_close.py 의 diff 는 162 insertions / 0 deletions 로 기존 검사를 한 줄도 고치지 않았다(git diff --numstat). AC-8 은 이 회차가 관측할 수 없는 부분이 있다 — 「종료 검사 절차 문서에 이 예외가 인쇄된다」는 이 run 의 check-6 exit 0 이 보이지만, 「같은 커밋에 있다」는 통합 커밋이 나야 참이 된다. 지금 지목할 수 있는 것은 core/workflows/plan-close/SKILL.md 와 romeo/close.py 가 이 run 의 증거 changed_files 에 함께 실려 있다는 것, 즉 둘이 한 변경 집합에 있다는 사실뿐이다. 커밋은 구현자의 권한이 아니라 통합 단계의 행위이므로 그 마지막 한 걸음은 미관측이다. 체크박스를 채운 것은 이 근거를 지목한 완료 주장이고, 그 주장이 충분한지는 검토자가 대조한다. 구현 단위 4 의 progress.md 갱신을 했다 — 「지금 상태」 블록에 활성 단위·Q-68 해소·Q-71~Q-77·다음 후보를 반영했다. 고치지 않고 보고만 하는 것(§12): 그 블록은 이 단위 이전부터 자기 예산을 넘겨 있었다(95b34eb 시점 3151바이트, 선언된 예산 2KB · 줄수는 26/30 으로 안이었다). 내 편집 뒤 28줄 3422바이트로 줄 예산 안에는 남지만 바이트 예산 초과는 커졌다. 그 예산을 집행하는 검사는 없다(grep -rn 'progress.md' tests/ 는 0건). 이 단위의 수용 기준도 검증 계획도 그것을 겨누지 않으므로 고치지 않았다 — 예산을 줄일지 늘릴지는 이 문서를 읽는 사람의 결정이다."
}
