{
  "schema": "romeo/result-envelope@0.1.0",
  "unit_id": "feat-20260829-license-field-46an",
  "role": "reviewer",
  "task_envelope_ref": {
    "path": "docs/work/feat-20260829-license-field-46an/task/run_410f3f12a645-reviewer.json",
    "sha256": "eebccd2302f9799082547ee57e4bb2a4171073c1040e9197b28948afbce2d94a"
  },
  "checks": [],
  "gate_verdict": "FAIL",
  "blocked_reason": null,
  "findings": [
    {
      "summary": "AC-4('기존 하네스 테스트가 그대로 통과한다', spec.md:45)를 뒷받침하는 증거가 없다. AC-4 를 덮는 유일한 검사인 check-5(`python3 -m unittest discover -s tests`)가 exit_code 1 로 기록돼 있고 계약의 expect 는 exit 0 이다. 구현자 결과 계약도 같은 값을 싣고 gate_verdict 를 FAIL 로 냈다(result/run_5a5a894aa26d-implementer.json:33,41). 종료 검사가 이 명령을 다시 실행해도 결과는 같으므로 지금 상태로는 완료를 선언할 수 없다.",
      "file": "docs/work/feat-20260829-license-field-46an/evidence/run_5a5a894aa26d.yaml",
      "line": 62
    },
    {
      "summary": "'회귀 0' 주장의 근거가 증거 기록 명령 밖에서 손으로 작성됐다(K-51). notes 는 '구현 착수 전' 과 '구현 완료 후' 두 번의 테스트 실행이 같은 3건 실패를 냈다는 표를 제시하지만, evidence yaml 의 commands 에는 check-5 실행이 1건뿐이고 착수 전 baseline 실행의 기록·로그·log_sha256 이 없다. 재실행으로 확인될 수 없는 주장이므로 AC-4 의 근거가 아니라 미검증이다.",
      "file": "docs/work/feat-20260829-license-field-46an/result/run_5a5a894aa26d-implementer-notes.md",
      "line": 11
    },
    {
      "summary": "check-5 의 실패 원인이 이 단위의 allowed_paths 밖에 있어, 계약 범위 안에서는 required_checks 를 통과시킬 방법이 없다. 실패한 test_parity 케이스는 이 관측 케이스가 지목하는 과거 run(run_31e175742892·run_b5cdadaffcdc)의 커밋된 작업 계약을 앵커 검사하는데, 그 계약의 allowed_paths 는 옛 형태 [\"docs/work/…/\", \".\"](task/run_31e175742892-implementer.json:10-13)이고 HEAD c237ea9 의 envelope 계산과 어긋난다. fixtures/parity/ 와 과거 run 산출물은 구현자 계약의 allowed_paths(task/run_5a5a894aa26d-implementer.json:10-17) 밖이다. 검증 계획을 바꾸는 것은 구현 중 재량이 아니라 승인 대상이므로(D-27), 이 단위는 계획 수준의 결정 없이는 닫히지 않는다.",
      "file": "fixtures/parity/pr-license-field-t1-observed.yaml",
      "line": 19
    },
    {
      "summary": "증거의 앵커가 작업 계약과 어긋나 변경 범위를 증거만으로 검증할 수 없다. evidence 의 base_sha 는 0f7d73f 인데 두 작업 계약의 base_sha 는 c237ea9 이고, 그 결과 changed_files(114-143행)에 .github/workflows/harness.yml · romeo/envelope.py · tests/test_parity.py · docs/planning/*.md 처럼 구현자 allowed_paths 밖 파일이 들어 있다. 실제 작업 트리 변경은 review-tree-before 로그(.harness/runs/…/07-review-tree-before.log:3-24)에서 archive/*/_source.md 18개 · archive/README.md · scripts/{validate-repo-archive.sh,generate-archive-index.py,check-archive-licenses.py} 로 전부 범위 안이므로 범위 위반은 아니다. 기록의 정확성 문제이며, 이 상태에서는 allowed_paths 준수를 evidence 가 아니라 로그를 따로 열어야만 확인할 수 있다.",
      "file": "docs/work/feat-20260829-license-field-46an/evidence/run_5a5a894aa26d.yaml",
      "line": 11
    },
    {
      "summary": "참고: AC-1~AC-3 은 증거로 뒷받침된다. AC-1 은 check-6(exit 0, evidence:69-77)이 scripts/check-archive-licenses.py 로 계획 §1.3 표의 「_source.md 에 적는 값」 열(implementation-plan.md:70-89)과 18개 헤더 값을 대조하고 표에 없는 아카이브까지 실패로 잡으며 값을 하드코딩하지 않는다. AC-2 는 check-3 이 validate-repo-archive.sh:49-52 의 실패 사유 문자열까지 확인하고 mktemp 사본에만 쓴다. AC-3 은 generate-archive-index.py:198-208 의 라이선스 열과 check-4(exit 0)가 뒷받침한다. 네 검사 모두 작업 트리를 바꾸지 않고 재실행해도 결론이 같다. 남은 미충족 항목은 AC-4 하나다.",
      "file": "docs/work/feat-20260829-license-field-46an/spec.md",
      "line": 42
    }
  ],
  "evidence_ref": "docs/work/feat-20260829-license-field-46an/evidence/run_5a5a894aa26d.yaml"
}