{
  "schema": "romeo/result-envelope@0.1.0",
  "unit_id": "feat-20260829-m2-root-cause-review-20260829-44hm",
  "role": "implementer",
  "task_envelope_ref": {
    "path": "docs/work/feat-20260829-m2-root-cause-review-20260829-44hm/task/run_3589e602e8e0-implementer.json",
    "sha256": "6e6285b9e66d8fe9294e3f7a09d37a1a0439d8918066db77b3734c4f7ef557b3"
  },
  "checks": [
    {
      "id": "check-1",
      "command": "test -f docs/reviews/2026-08-29-m2-root-cause-review/REVIEW_FINDINGS.md && rg -n '^## (사용자 스토리|현재 관찰|근본 원인|권고|다음 확인)' docs/reviews/2026-08-29-m2-root-cause-review/REVIEW_FINDINGS.md",
      "exit_code": 0
    },
    {
      "id": "check-2",
      "command": "rg -n '사실|추론|미확인|SHA|근거' docs/reviews/2026-08-29-m2-root-cause-review/REVIEW_FINDINGS.md",
      "exit_code": 0
    },
    {
      "id": "check-3",
      "command": "git diff --check && bin/romeo validate",
      "exit_code": 0
    },
    {
      "id": "check-4",
      "command": "git diff --name-only HEAD -- core romeo adapters fixtures tests docs/planning docs/decisions docs/work/feat-20260829-license-field-46an | test ! -s /dev/stdin",
      "exit_code": 0
    }
  ],
  "gate_verdict": "PASS",
  "blocked_reason": null,
  "findings": [],
  "evidence_ref": "docs/work/feat-20260829-m2-root-cause-review-20260829-44hm/evidence/run_3589e602e8e0.yaml",
  "notes": "run_3589e602e8e0의 check-1~check-4가 모두 exit 0이다. AC-1~AC-4는 보고서와 이 evidence를 근거로 체크했고, AC-5 독립 검토는 반대 런타임 reviewer의 후속 작업이므로 체크하지 않았다. 같은 run의 current-ci-lookup은 exit 1이라 현재 HEAD의 원격 CI는 미확인이고, orca-runtime-status는 runtime.reachable=false를 기록했다."
}
