{
  "schema": "romeo/result-envelope@0.1.0",
  "unit_id": "feat-20260901-scenario-8-capability-probe-s7ny",
  "role": "reviewer",
  "task_envelope_ref": {
    "path": "docs/work/feat-20260901-scenario-8-capability-probe-s7ny/task/run_d7092f3d25c5-reviewer.json",
    "sha256": "fb0aa49b2f8c2e7cac41f7f0acfc461ddb689d6579a42f9df435a3c323635178"
  },
  "checks": [],
  "gate_verdict": "PASS",
  "blocked_reason": null,
  "findings": [
    {
      "summary": "구현자 계약의 allowed_paths에 함수명 `cmd_card`가 독립 경로로 포함되어 승인된 변경 범위보다 쓰기 상한이 넓다. 현재 changed_files에는 이 경로에 대한 쓰기가 없어 OUT_OF_SCOPE_WRITE에는 해당하지 않는다.",
      "file": "docs/work/feat-20260901-scenario-8-capability-probe-s7ny/task/run_d7092f3d25c5-implementer.json",
      "line": 23
    }
  ],
  "evidence_ref": "docs/work/feat-20260901-scenario-8-capability-probe-s7ny/evidence/run_d7092f3d25c5.yaml",
  "notes": "두 작업 계약의 base_sha가 일치한다. AC-1부터 AC-10까지 현재 파일과 기록된 증거로 지목할 수 있으며 required_checks 10건은 모두 exit 0이다. 검증 계획은 승인된 spec 및 두 작업 계약과 일치하고, 증거의 head_sha는 현재 HEAD와 같다. 제품 변경 21개는 evidence.changed_files와 일치하며 구현자 계약의 allowed_paths 안이다. guards는 비어 있다."
}
