{
  "schema": "romeo/result-envelope@0.1.0",
  "unit_id": "init-20260911-m5-attach-update-rollback-sauc",
  "role": "reviewer",
  "task_envelope_ref": {
    "path": "docs/work/init-20260911-m5-attach-update-rollback-sauc/task/run_877628bab8bd-reviewer.json",
    "sha256": "b07abd8412f2ccf5ae40c7f8ffacd0089f03ac6ad078b58ac20e35c5dedf217d"
  },
  "checks": [],
  "gate_verdict": "PASS",
  "blocked_reason": null,
  "findings": [],
  "evidence_ref": "docs/work/init-20260911-m5-attach-update-rollback-sauc/evidence/run_877628bab8bd.yaml",
  "notes": "두 계약의 base_sha와 현재 HEAD가 일치한다. 수용 기준 문장은 체크 표시 외에 변경되지 않았고 required_checks 6건도 유지됐다. AC-1~AC-9는 tests/test_attach_manifest.py의 실제 명령 호출·단언과 해당 run의 01-check-1.log(13건 통과)가 뒷받침하며, AC-2는 02-check-2.log에서도 확인된다. 이전 AC-9의 대문자 hex 누락은 코드와 추가 테스트의 통과 기록으로 해소됐다. 검사 6건의 종료 코드와 원시 로그가 일치하고 전체 테스트 1,077건이 통과했다. 검사는 임시 사본을 사용해 재실행 가능하며, 확인된 변경은 allowed_paths 안이다. 가드 승인 로그는 검사 실행보다 앞선다. 파일 수정·검사 재실행·해시 계산은 하지 않았다. 현재 트리 해시 재계산과 검토 전후 방어 검사는 위임한 쪽에서 수행해야 한다."
}
