{
  "schema": "romeo/result-envelope@0.1.0",
  "unit_id": "feat-20260901-coordinator-procedure-gaps-y8fu",
  "role": "implementer",
  "task_envelope_ref": {
    "path": "docs/work/feat-20260901-coordinator-procedure-gaps-y8fu/task/run_30aed12f8de0-implementer.json",
    "sha256": "738d358cc4b872cbfe5562fc414287796bb36a74fe9147f801e92dc39727349f"
  },
  "checks": [
    {
      "id": "check-1",
      "command": "awk '/^### 3\\.1 /,/^### 3\\.2 /' adapters/orca/RUNBOOK.md | grep -q 'attempts\\.yaml'",
      "exit_code": 0
    },
    {
      "id": "check-2",
      "command": "awk '/^### 3\\.1 /,/^### 3\\.2 /' adapters/orca/RUNBOOK.md | grep -qE 'git (show|diff|ls-tree)[^|]*attempts\\.yaml'",
      "exit_code": 0
    },
    {
      "id": "check-3",
      "command": "python3 -m unittest tests.test_runbook_procedure -v",
      "exit_code": 0
    },
    {
      "id": "check-4",
      "command": "awk '/^## 3\\. 실행 순서/,/^## 4\\./' adapters/orca/RUNBOOK.md | grep -qE '^### 3\\.[0-9.]+ .*재작업'",
      "exit_code": 0
    },
    {
      "id": "check-5",
      "command": "python3 -c \"import re,sys; t=open('adapters/orca/RUNBOOK.md').read(); m=re.search(r'^### 3\\.[0-9.]+ [^\\n]*재작업[^\\n]*\\n(.*?)(?=^#{2,3} )', t, re.S|re.M); b=m.group(1) if m else ''; sys.exit(0 if '_stamp_ids' in b and 'run-create' in b else 1)\"",
      "exit_code": 0
    },
    {
      "id": "check-6",
      "command": "awk '/^## 3\\. 실행 순서/,/^## 4\\./' adapters/orca/RUNBOOK.md | grep -q 'run-use --id'",
      "exit_code": 0
    },
    {
      "id": "check-7",
      "command": "awk '/^## 3\\. 실행 순서/,/^## 4\\./' adapters/orca/RUNBOOK.md | grep -q 'run-current'",
      "exit_code": 0
    },
    {
      "id": "check-8",
      "command": "python3 -c \"import yaml,sys; d=yaml.safe_load(open('.harness/observations.yaml')); k=d.get('coordinator_run_rebinding'); sys.exit(0 if k and str(k).strip() else 1)\"",
      "exit_code": 0
    },
    {
      "id": "check-9",
      "command": "grep -q 'feat-20260901-coordinator-procedure-gaps-y8fu' docs/planning/progress.md",
      "exit_code": 0
    },
    {
      "id": "check-10",
      "command": "! grep -q '다음 정비 후보다' docs/planning/progress.md",
      "exit_code": 0
    },
    {
      "id": "check-11",
      "command": "python3 -m unittest discover -s tests",
      "exit_code": 0
    },
    {
      "id": "check-12",
      "command": "bin/romeo validate",
      "exit_code": 0
    },
    {
      "id": "check-13",
      "command": "bin/romeo doctor --strict --scope repository",
      "exit_code": 0
    },
    {
      "id": "check-14",
      "command": "bin/romeo compile --check",
      "exit_code": 0
    }
  ],
  "gate_verdict": "PASS",
  "blocked_reason": null,
  "findings": [],
  "evidence_ref": "docs/work/feat-20260901-coordinator-procedure-gaps-y8fu/evidence/run_30aed12f8de0.yaml",
  "notes": "14/14 exit 0 · gate_verdict PASS. 증거는 run_30aed12f8de0 의 evidence checks 한 번으로만 만들었고 손으로 쓴 기록은 없다(K-51).\n\n**승인된 구현 단위 4 의 서술 한 곳이 실측과 달랐다 — 문서에는 실측값을 적었다.** spec 구현 단위 4 는 「거부가 종료 코드 0 에 `.ok == false` 로 온다는 것을 적는다」 고 지시하는데, 2026-09-01 실측에서 그 거부는 **종료 코드 1** 이었다. 근거: docs/work/feat-20260901-coordinator-procedure-gaps-y8fu/observation/run-rebinding-probe.log 의 §4(`check --run` · `task-update` 각 1회 — 둘 다 exit 1 · `.ok == false` · `error.code == \"consumer_fenced\"`)와 §8(`check --run` 1회 — 같은 모양). 위임 지시문이 「안 되는 것이 있으면 안 된다고 적는다. 되는 것처럼 적지 않는다」 고 요구하므로 RUNBOOK §3.2 에는 실측값(exit 1)을 적고, 2026-08-29 기록(§11.1)과 다르다는 사실과 어느 쪽이 옳은지 이 관측이 가리지 못한다는 것을 함께 적었다. 확인란과 검증 계획은 고치지 않았고, AC-4 는 종료 코드를 요구하지 않으므로(요구하는 것은 전환 명령과 현재 바인딩 확인 명령) 이 차이가 AC 충족을 바꾸지 않는다.\n\n**AC-5 실측은 별도 터미널(term_83b2d605-1c67-4307-8ce4-10a062f0b8a6, `orca terminal create`)에서 했다.** 구현자 터미널에서 `run-create` 를 부르면 이 Run(run_30aed12f8de0)과의 바인딩이 끊겨 worker_done 을 보내지 못하기 때문이다. 이 제약 자체를 `.harness/observations.yaml` 의 `coordinator_run_rebinding.where` 에 적었다. 관측이 만든 Run 두 개(run_e5ee724a61b5 · run_054594259ff6)는 확인란이 승인한 대로 지우지 않고 남긴다.\n\n**`.harness/observations.yaml` 은 evidence 의 changed_files 에 나타나지 않는다** — `romeo/evidence.py` 의 `exclusions()` 가 `.harness/` 를 트리 해시에서 빼기 때문이고, 그 키가 실재하는지는 check-8(exit 0)이 판정한다.\n\n**§3.1 확인 2 의 `git ls-tree` 8행 판정은 깨지지 않았다** — 확인 4 는 그 목록에 파일을 더한 것이 아니라 확인을 하나 더 만든 것이다. `tests/test_runbook_procedure.py::TestRunbookProcedureAnchors::test_ls_tree_check_still_lists_eight_paths` 가 그것을 고정하고, a1bfeac 에 대고 실행한 그 명령도 8행을 냈다."
}
